{
  "$schema": "../schema/dsds.bundled.schema.json",
  "dsdsVersion": "0.16.0",
  "systemInfo": {
    "organization": "Acme Corp",
    "url": "https://design.acme.com",
    "name": "Acme Design System",
    "version": "2.0.0"
  },
  "documentBlocks": [
    {
      "kind": "sections",
      "items": [
        {
          "title": "Overview",
          "body": "The Acme Design System provides a shared library of reusable components, design tokens, and patterns that enable product teams to build consistent, accessible user interfaces across web, iOS, and Android platforms. It encodes Acme's design language into a single source of truth so that designers and engineers work from the same specifications."
        }
      ]
    },
    {
      "kind": "use-cases",
      "items": [
        {
          "description": "When building a new product or feature within the Acme product suite that must conform to the Acme brand and interaction standards.",
          "stance": "recommended"
        },
        {
          "description": "When an existing product is being redesigned or migrated to a modern front-end stack and needs a consistent component library.",
          "stance": "recommended"
        },
        {
          "description": "When contributing a new component or pattern that will be shared across multiple Acme products.",
          "stance": "recommended"
        },
        {
          "description": "When building a white-label product that must not carry the Acme brand identity.",
          "stance": "discouraged",
          "alternative": {
            "identifier": "custom theme or independent design system",
            "rationale": "The Acme Design System encodes Acme-specific brand decisions (color palette, typography, iconography). White-label products require a neutral foundation that can be re-skinned per customer. Use the token architecture as inspiration, but do not depend on Acme-branded tokens directly."
          }
        },
        {
          "description": "When building a one-off marketing landing page with highly custom, editorial layouts that intentionally break grid and component conventions.",
          "stance": "discouraged",
          "alternative": {
            "identifier": "bespoke implementation with brand guidelines",
            "rationale": "Marketing pages often require creative freedom that a component system constrains. Use the brand color tokens and typography scale for consistency, but do not force editorial layouts into rigid component patterns."
          }
        }
      ]
    },
    {
      "kind": "guidelines",
      "items": [
        {
          "guidance": "Use semantic tokens instead of raw color, spacing, or typography values in all production code.",
          "rationale": "Semantic tokens abstract the intent (ex: 'color-text-primary') from the value (ex: '#1a1a1a'). This enables theming, dark mode, and system-wide visual changes from a single source of truth without touching component code.",
          "level": "must",
          "category": "development"
        },
        {
          "guidance": "Do not modify or override design token values at the component level. Use the token as-is or request a new token.",
          "rationale": "Overriding tokens breaks the contract between the design system and consuming products. When the system updates a token value, overridden components will not pick up the change, creating visual drift.",
          "level": "must-not",
          "category": "development"
        },
        {
          "guidance": "Test all components at 200% browser zoom to ensure content does not overflow, overlap, or become inaccessible.",
          "rationale": "WCAG 1.4.4 requires that content remains functional at 200% text size. Components that break at zoom levels below 200% fail this criterion and exclude users with low vision.",
          "level": "must",
          "category": "accessibility",
          "references": [
            {
              "url": "https://www.w3.org/TR/WCAG22/#resize-text",
              "label": "1.4.4 Resize Text"
            }
          ]
        },
        {
          "guidance": "Prefer composition over customization. Combine existing components to build new patterns rather than adding configuration props to existing components.",
          "rationale": "Every prop added to a component increases its API surface, testing burden, and cognitive load. Composing simple components into larger patterns keeps each component focused and predictable.",
          "level": "should",
          "category": "development"
        },
        {
          "guidance": "Every interactive component must be fully operable with a keyboard alone — no mouse or touch required.",
          "rationale": "Keyboard operability is the foundation of accessibility. Users who rely on switch devices, screen readers, or alternative input methods all depend on keyboard support as the lowest common denominator.",
          "level": "must",
          "category": "accessibility",
          "references": [
            {
              "url": "https://www.w3.org/TR/WCAG22/#keyboard",
              "label": "2.1.1 Keyboard"
            }
          ]
        },
        {
          "guidance": "Pin the design system package version in production applications. Upgrade deliberately, not automatically.",
          "rationale": "Automatic upgrades can introduce visual regressions or breaking API changes. Pinning versions ensures stability while allowing teams to upgrade on their own schedule after testing.",
          "level": "should",
          "category": "development"
        },
        {
          "guidance": "Do not wrap design system components in additional DOM elements that alter their semantics or accessibility tree.",
          "rationale": "Wrapping a button in a div with an onClick handler, or nesting a link inside a button, creates unexpected behavior for assistive technology. Use components as designed — their semantic structure is intentional.",
          "level": "must-not",
          "category": "accessibility"
        },
        {
          "guidance": "When contributing a new component, provide at minimum: a purpose block, an API spec, and usage guidelines before publishing to production.",
          "rationale": "Components without documentation are components without a contract. Consumers cannot use them correctly if the intended use cases, API, and constraints are not documented.",
          "level": "must",
          "category": "content"
        }
      ]
    }
  ],
  "entityGroups": [
    {
      "name": "Acme Design System — Starter Kit",
      "description": "A representative sample of components, tokens, a foundation, and a pattern demonstrating DSDS document structure.",
      "entities": [
        {
          "kind": "component",
          "identifier": "button",
          "name": "Button",
          "description": "A clickable element that triggers an action. Buttons are the primary mechanism for submitting forms, opening dialogs, confirming decisions, and initiating operations.",
          "metadata": {
            "status": "stable",
            "since": "1.0.0",
            "lastUpdated": {
              "date": "2026-05-28",
              "note": "Added focus-visible guidance and tightened tap-target language."
            },
            "category": "action",
            "links": [
              {
                "kind": "source",
                "url": "https://code.acme.com/design-system/src/components/button/button.tsx",
                "label": "Source code"
              },
              {
                "kind": "documentation",
                "url": "https://design.acme.com/components/button",
                "label": "Documentation"
              }
            ],
            "tags": [
              "action",
              "submit",
              "click",
              "CTA",
              "trigger",
              "call-to-action",
              "interactive"
            ]
          },
          "documentBlocks": [
            {
              "kind": "variants",
              "items": [
                {
                  "kind": "enum",
                  "identifier": "emphasis",
                  "name": "Emphasis",
                  "description": "The visual weight of the button, indicating the relative importance of the action.",
                  "values": [
                    {
                      "identifier": "primary",
                      "description": "The highest-emphasis button. Used for the single most important action on the surface."
                    },
                    {
                      "identifier": "secondary",
                      "description": "A medium-emphasis button with a visible border. Used alongside a primary button for secondary actions."
                    },
                    {
                      "identifier": "ghost",
                      "description": "A low-emphasis button with no border or background. Used for tertiary actions in dense layouts."
                    }
                  ]
                },
                {
                  "kind": "enum",
                  "identifier": "size",
                  "name": "Size",
                  "description": "Controls padding, font size, and minimum touch target area.",
                  "values": [
                    {
                      "identifier": "small",
                      "description": "Compact size for dense layouts such as toolbars and table rows."
                    },
                    {
                      "identifier": "medium",
                      "description": "Default size for most contexts."
                    },
                    {
                      "identifier": "large",
                      "description": "Large size for hero surfaces and mobile-first layouts."
                    }
                  ]
                }
              ]
            },